{"protocolVersion":"1.0","jobId":"33333333-3333-4333-8333-333333333333","organizationId":"22222222-2222-4222-8222-222222222222","agentId":"11111111-1111-4111-8111-111111111111","moduleId":"mock.safe","moduleVersionRequirement":"1.0.0","scopeId":"44444444-4444-4444-8444-444444444444","scopeEnvironment":"INTERNAL","target":{"type":"HOSTNAME","value":"fixture.test.invalid"},"validatedParameters":{"mode":"synthetic"},"riskClass":"PASSIVE","authorizationReference":"test-only:fixture","issuedAt":"2026-08-11T12:00:00Z","expiresAt":"2026-08-11T12:05:00Z","timeoutSeconds":30,"nonce":"aaaaaaaaaaaaaaaaaaaaaaaaaaaaaaaa"}
